ID,Title,Description
1101020304,"Sun, Moon, Mars, and Mercury in conjunction","A combination of vitality, emotions, courage, and intellect. Individuals may exhibit strong leadership, emotional intelligence, assertiveness, and sharp communication skills."
1101020305,"Sun, Moon, Mars, and Jupiter in conjunction","Merges vitality, emotions, courage, and wisdom. This can indicate a person with moral values, leadership abilities, enthusiasm, and a philosophical outlook."
1101020306,"Sun, Moon, Mars, and Venus in conjunction","Combines vitality, emotions, courage, and love. Such individuals might be passionate, artistic, emotionally deep, and charismatic."
1101020307,"Sun, Moon, Mars, and Saturn in conjunction","Blends vitality, emotions, courage, and discipline. It may bring challenges that require perseverance and resilience, leading to personal growth."
1101020308,"Sun, Moon, Mars, and Rahu in conjunction","Unites vitality, emotions, courage, and ambition. This can indicate intense desires, unconventional thinking, and a strong drive to achieve goals."
1101020309,"Sun, Moon, Mars, and Ketu in conjunction","Combines vitality, emotions, courage, and spirituality. Individuals may be introspective, spiritually inclined, and may seek detachment from material pursuits."
1101020405,"Sun, Moon, Mercury, and Jupiter in conjunction","Integrates vitality, emotions, intellect, and wisdom. This may indicate excellent learning abilities, intuition, eloquence, and a philosophical mindset."
1101020406,"Sun, Moon, Mercury, and Venus in conjunction","A blend of vitality, emotions, intellect, and love. Individuals might be creative, emotionally expressive, and have harmonious relationships."
1101020407,"Sun, Moon, Mercury, and Saturn in conjunction","Combines vitality, emotions, intellect, and discipline. May lead to challenges in communication but also deep thinking and emotional maturity."
1101020408,"Sun, Moon, Mercury, and Rahu in conjunction","Merges vitality, emotions, intellect, and ambition. Indicates innovative thinking, emotional intensity, and a desire to explore new paths."
1101020409,"Sun, Moon, Mercury, and Ketu in conjunction","Combines vitality, emotions, intellect, and spirituality. May suggest introspective thinking, spiritual studies, and a tendency towards detachment."
1101020506,"Sun, Moon, Jupiter, and Venus in conjunction","Brings together vitality, emotions, wisdom, and love. Individuals may have strong ethical values, compassion, and appreciation for beauty and art."
1101020507,"Sun, Moon, Jupiter, and Saturn in conjunction","Combines vitality, emotions, wisdom, and discipline. Indicates deep insights, patience, and the ability to overcome obstacles through perseverance."
1101020508,"Sun, Moon, Jupiter, and Rahu in conjunction","Merges vitality, emotions, wisdom, and ambition. Suggests a desire for expansion and growth through unconventional means."
1101020509,"Sun, Moon, Jupiter, and Ketu in conjunction","Combines vitality, emotions, wisdom, and spirituality. May indicate philosophical inclinations and spiritual wisdom."
1101020607,"Sun, Moon, Venus, and Saturn in conjunction","Blends vitality, emotions, love, and discipline. Could lead to challenges in relationships but also the potential for lasting bonds."
1101020608,"Sun, Moon, Venus, and Rahu in conjunction","Merges vitality, emotions, love, and ambition. Indicates intense desires and attraction to luxury."
1101020609,"Sun, Moon, Venus, and Ketu in conjunction","Combines vitality, emotions, love, and spirituality. Suggests seeking higher love and artistic expression."
1101020708,"Sun, Moon, Saturn, and Rahu in conjunction","Integrates vitality, emotions, discipline, and ambition. Indicates overcoming challenges to achieve goals."
1101020709,"Sun, Moon, Saturn, and Ketu in conjunction","Combines vitality, emotions, discipline, and spirituality. May suggest a focus on inner strength and spiritual growth."
1101030405,"Sun, Mars, Mercury, and Jupiter in conjunction","Unites vitality, courage, intellect, and wisdom. Suggests leadership, strategic thinking, and strong decision-making abilities."
1101030406,"Sun, Mars, Mercury, and Venus in conjunction","Blends vitality, courage, intellect, and love. Indicates passion, creativity, and persuasive communication skills."
1101030407,"Sun, Mars, Mercury, and Saturn in conjunction","Combines vitality, courage, intellect, and discipline. May face communication challenges but possess strategic planning abilities."
1101030408,"Sun, Mars, Mercury, and Rahu in conjunction","Merges vitality, courage, intellect, and ambition. Suggests innovative ideas and assertiveness."
1101030409,"Sun, Mars, Mercury, and Ketu in conjunction","Combines vitality, courage, intellect, and spirituality. Indicates sharp insights and spiritual courage."
1101030506,"Sun, Mars, Jupiter, and Venus in conjunction","Brings together vitality, courage, wisdom, and love. Individuals may have strong desires, ethical values, and charisma."
1101030507,"Sun, Mars, Jupiter, and Saturn in conjunction","Combines vitality, courage, wisdom, and discipline. Suggests resilience and the ability to overcome obstacles."
1101030508,"Sun, Mars, Jupiter, and Rahu in conjunction","Merges vitality, courage, wisdom, and ambition. Indicates a drive for success through unconventional methods."
1101030509,"Sun, Mars, Jupiter, and Ketu in conjunction","Combines vitality, courage, wisdom, and spirituality. Suggests a focus on higher knowledge and spiritual pursuits."
1101030607,"Sun, Mars, Venus, and Saturn in conjunction","Blends vitality, courage, love, and discipline. May face challenges in expressing desires but can achieve lasting success."
1101030608,"Sun, Mars, Venus, and Rahu in conjunction","Merges vitality, courage, love, and ambition. Indicates passionate pursuits and attraction to excitement."
1101030609,"Sun, Mars, Venus, and Ketu in conjunction","Combines vitality, courage, love, and spirituality. Suggests deep passions directed towards spiritual or artistic endeavors."
1101030708,"Sun, Mars, Saturn, and Rahu in conjunction","Unites vitality, courage, discipline, and ambition. Indicates determination to overcome challenges."
1101030709,"Sun, Mars, Saturn, and Ketu in conjunction","Combines vitality, courage, discipline, and spirituality. Suggests transforming hardships into spiritual strength."
1101040506,"Sun, Mercury, Jupiter, and Venus in conjunction","Integrates vitality, intellect, wisdom, and love. Indicates strong communication skills and artistic talents."
1101040507,"Sun, Mercury, Jupiter, and Saturn in conjunction","Combines vitality, intellect, wisdom, and discipline. May suggest deep thinking and a serious demeanor."
1101040508,"Sun, Mercury, Jupiter, and Rahu in conjunction","Merges vitality, intellect, wisdom, and ambition. Indicates innovative ideas and a desire for expansion."
1101040509,"Sun, Mercury, Jupiter, and Ketu in conjunction","Combines vitality, intellect, wisdom, and spirituality. Suggests inclinations towards philosophical studies."
1101040607,"Sun, Mercury, Venus, and Saturn in conjunction","Blends vitality, intellect, love, and discipline. May face relationship challenges but seek profound understanding."
1101040608,"Sun, Mercury, Venus, and Rahu in conjunction","Merges vitality, intellect, love, and ambition. Indicates creative expression and unconventional relationships."
1101040609,"Sun, Mercury, Venus, and Ketu in conjunction","Combines vitality, intellect, love, and spirituality. Suggests artistic talents with a spiritual focus."
1101040708,"Sun, Mercury, Saturn, and Rahu in conjunction","Unites vitality, intellect, discipline, and ambition. Indicates overcoming challenges through innovative thinking."
1101040709,"Sun, Mercury, Saturn, and Ketu in conjunction","Combines vitality, intellect, discipline, and spirituality. Suggests deep contemplation and inner growth."
1101050607,"Sun, Jupiter, Venus, and Saturn in conjunction","Brings together vitality, wisdom, love, and discipline. Indicates strong moral values and personal growth."
1101050608,"Sun, Jupiter, Venus, and Rahu in conjunction","Merges vitality, wisdom, love, and ambition. Suggests seeking success through unconventional means."
1101050609,"Sun, Jupiter, Venus, and Ketu in conjunction","Combines vitality, wisdom, love, and spirituality. Indicates a focus on higher knowledge and spiritual love."
1101050708,"Sun, Jupiter, Saturn, and Rahu in conjunction","Integrates vitality, wisdom, discipline, and ambition. Suggests striving for success while overcoming obstacles."
1101050709,"Sun, Jupiter, Saturn, and Ketu in conjunction","Combines vitality, wisdom, discipline, and spirituality. Indicates a focus on inner growth and spiritual discipline."
1101060708,"Sun, Venus, Saturn, and Rahu in conjunction","Blends vitality, love, discipline, and ambition. May face relationship challenges but have a drive for success."
1101060709,"Sun, Venus, Saturn, and Ketu in conjunction","Combines vitality, love, discipline, and spirituality. Suggests seeking meaningful relationships with spiritual depth."
1101070809,"Sun, Saturn, Rahu, and Ketu in conjunction","This combination is not possible as Rahu and Ketu cannot be in conjunction."
1102030405,"Moon, Mars, Mercury, and Jupiter in conjunction","Unites emotions, courage, intellect, and wisdom. Indicates strong intuition and communication skills."
1102030406,"Moon, Mars, Mercury, and Venus in conjunction","Blends emotions, courage, intellect, and love. Suggests passion, creativity, and emotional depth."
1102030407,"Moon, Mars, Mercury, and Saturn in conjunction","Combines emotions, courage, intellect, and discipline. May face emotional challenges but possess mental resilience."
1102030408,"Moon, Mars, Mercury, and Rahu in conjunction","Merges emotions, courage, intellect, and ambition. Indicates intense feelings and innovative ideas."
1102030409,"Moon, Mars, Mercury, and Ketu in conjunction","Combines emotions, courage, intellect, and spirituality. Suggests introspection and spiritual courage."
1102030506,"Moon, Mars, Jupiter, and Venus in conjunction","Brings together emotions, courage, wisdom, and love. Indicates compassion and a balance of strength and kindness."
1102030507,"Moon, Mars, Jupiter, and Saturn in conjunction","Combines emotions, courage, wisdom, and discipline. Suggests resilience and overcoming emotional obstacles."
1102030508,"Moon, Mars, Jupiter, and Rahu in conjunction","Merges emotions, courage, wisdom, and ambition. Indicates a drive to achieve with passion."
1102030509,"Moon, Mars, Jupiter, and Ketu in conjunction","Combines emotions, courage, wisdom, and spirituality. Suggests seeking higher knowledge with emotional depth."
1102030607,"Moon, Mars, Venus, and Saturn in conjunction","Blends emotions, courage, love, and discipline. May face relationship challenges but seek stability."
1102030608,"Moon, Mars, Venus, and Rahu in conjunction","Merges emotions, courage, love, and ambition. Indicates passionate relationships and attraction to excitement."
1102030609,"Moon, Mars, Venus, and Ketu in conjunction","Combines emotions, courage, love, and spirituality. Suggests deep feelings towards spiritual pursuits."
1102030708,"Moon, Mars, Saturn, and Rahu in conjunction","Unites emotions, courage, discipline, and ambition. Indicates overcoming emotional challenges for transformation."
1102030709,"Moon, Mars, Saturn, and Ketu in conjunction","Combines emotions, courage, discipline, and spirituality. Suggests transforming hardships into spiritual growth."
1102040506,"Moon, Mercury, Jupiter, and Venus in conjunction","Integrates emotions, intellect, wisdom, and love. Indicates empathy, communication skills, and artistic talents."
1102040507,"Moon, Mercury, Jupiter, and Saturn in conjunction","Combines emotions, intellect, wisdom, and discipline. May face challenges in expression but have deep understanding."
1102040508,"Moon, Mercury, Jupiter, and Rahu in conjunction","Merges emotions, intellect, wisdom, and ambition. Indicates innovative thinking with emotional intensity."
1102040509,"Moon, Mercury, Jupiter, and Ketu in conjunction","Combines emotions, intellect, wisdom, and spirituality. Suggests inclinations towards spiritual studies."
1102040607,"Moon, Mercury, Venus, and Saturn in conjunction","Blends emotions, intellect, love, and discipline. May face relationship challenges but seek profound connections."
1102040608,"Moon, Mercury, Venus, and Rahu in conjunction","Merges emotions, intellect, love, and ambition. Indicates creative expression and unconventional relationships."
1102040609,"Moon, Mercury, Venus, and Ketu in conjunction","Combines emotions, intellect, love, and spirituality. Suggests artistic talents with a focus on healing."
1102040708,"Moon, Mercury, Saturn, and Rahu in conjunction","Unites emotions, intellect, discipline, and ambition. Indicates overcoming challenges with innovative solutions."
1102040709,"Moon, Mercury, Saturn, and Ketu in conjunction","Combines emotions, intellect, discipline, and spirituality. Suggests deep contemplation and emotional maturity."
1102050607,"Moon, Jupiter, Venus, and Saturn in conjunction","Brings together emotions, wisdom, love, and discipline. Indicates compassion and emotional maturity."
1102050608,"Moon, Jupiter, Venus, and Rahu in conjunction","Merges emotions, wisdom, love, and ambition. Suggests seeking growth in love through unconventional means."
1102050609,"Moon, Jupiter, Venus, and Ketu in conjunction","Combines emotions, wisdom, love, and spirituality. Indicates inclinations towards spiritual love and practices."
1102050708,"Moon, Jupiter, Saturn, and Rahu in conjunction","Integrates emotions, wisdom, discipline, and ambition. Suggests striving for emotional success while overcoming obstacles."
1102050709,"Moon, Jupiter, Saturn, and Ketu in conjunction","Combines emotions, wisdom, discipline, and spirituality. Indicates focus on inner growth and healing."
1102060708,"Moon, Venus, Saturn, and Rahu in conjunction","Blends emotions, love, discipline, and ambition. May face relationship challenges but have a drive for success."
1102060709,"Moon, Venus, Saturn, and Ketu in conjunction","Combines emotions, love, discipline, and spirituality. Suggests seeking meaningful relationships with spiritual depth."
1103040506,"Mars, Mercury, Jupiter, and Venus in conjunction","Unites courage, intellect, wisdom, and love. Indicates leadership qualities and persuasive abilities."
1103040507,"Mars, Mercury, Jupiter, and Saturn in conjunction","Combines courage, intellect, wisdom, and discipline. Suggests strategic thinking and resilience."
1103040508,"Mars, Mercury, Jupiter, and Rahu in conjunction","Merges courage, intellect, wisdom, and ambition. Indicates innovative strategies and a drive for success."
1103040509,"Mars, Mercury, Jupiter, and Ketu in conjunction","Combines courage, intellect, wisdom, and spirituality. Suggests sharp insights and philosophical inclinations."
1103040607,"Mars, Mercury, Venus, and Saturn in conjunction","Blends courage, intellect, love, and discipline. May face challenges in expressing desires but achieve thoughtful actions."
1103040608,"Mars, Mercury, Venus, and Rahu in conjunction","Merges courage, intellect, love, and ambition. Indicates passionate pursuits and unconventional relationships."
1103040609,"Mars, Mercury, Venus, and Ketu in conjunction","Combines courage, intellect, love, and spirituality. Suggests deep passions directed towards artistic endeavors."
1103040708,"Mars, Mercury, Saturn, and Rahu in conjunction","Unites courage, intellect, discipline, and ambition. Indicates overcoming obstacles through innovative thinking."
1103040709,"Mars, Mercury, Saturn, and Ketu in conjunction","Combines courage, intellect, discipline, and spirituality. Suggests transforming challenges into wisdom."
1103050607,"Mars, Jupiter, Venus, and Saturn in conjunction","Brings together courage, wisdom, love, and discipline. Indicates determination and harmonious relationships."
1103050608,"Mars, Jupiter, Venus, and Rahu in conjunction","Merges courage, wisdom, love, and ambition. Suggests pursuing goals with passion and unconventional methods."
1103050609,"Mars, Jupiter, Venus, and Ketu in conjunction","Combines courage, wisdom, love, and spirituality. Indicates inclinations towards spiritual pursuits."
1103050708,"Mars, Jupiter, Saturn, and Rahu in conjunction","Integrates courage, wisdom, discipline, and ambition. Suggests striving for greatness while overcoming challenges."
1103050709,"Mars, Jupiter, Saturn, and Ketu in conjunction","Combines courage, wisdom, discipline, and spirituality. Indicates focus on spiritual growth."
1103060708,"Mars, Venus, Saturn, and Rahu in conjunction","Blends courage, love, discipline, and ambition. May face relationship challenges but have a strong drive."
1103060709,"Mars, Venus, Saturn, and Ketu in conjunction","Combines courage, love, discipline, and spirituality. Suggests passionate pursuits directed towards growth."
1104050607,"Mercury, Jupiter, Venus, and Saturn in conjunction","Unites intellect, wisdom, love, and discipline. Indicates deep thinking and a strong sense of responsibility."
1104050608,"Mercury, Jupiter, Venus, and Rahu in conjunction","Merges intellect, wisdom, love, and ambition. Suggests innovative ideas and unconventional approaches."
1104050609,"Mercury, Jupiter, Venus, and Ketu in conjunction","Combines intellect, wisdom, love, and spirituality. Indicates inclinations towards philosophical studies."
1104050708,"Mercury, Jupiter, Saturn, and Rahu in conjunction","Integrates intellect, wisdom, discipline, and ambition. Suggests strategic thinking and success."
1104050709,"Mercury, Jupiter, Saturn, and Ketu in conjunction","Combines intellect, wisdom, discipline, and spirituality. Indicates deep contemplation and inner growth."
1104060708,"Mercury, Venus, Saturn, and Rahu in conjunction","Blends intellect, love, discipline, and ambition. May face relationship challenges but have innovative ideas."
1104060709,"Mercury, Venus, Saturn, and Ketu in conjunction","Combines intellect, love, discipline, and spirituality. Suggests seeking meaningful connections."
1105060708,"Jupiter, Venus, Saturn, and Rahu in conjunction","Merges wisdom, love, discipline, and ambition. Indicates striving for success through unconventional means."
1105060709,"Jupiter, Venus, Saturn, and Ketu in conjunction","Combines wisdom, love, discipline, and spirituality. Suggests inclinations towards spiritual practices."
